{
  "schema_version": "1.0.0", "tier": "A_kernel", "id": "sdpa_forward_a", "name": "SDPA forward kernel", "family": "sdpa_forward",
  "source": {"project": "archived_upstream", "revision": "0123456789abcdef", "license": "Apache-2.0", "snapshot": "sources/sdpa_forward"},
  "target_environment": {"device_families": ["MTT S4000", "MTT S5000"], "architectures": ["mp_22", "mp_31"], "toolkit_constraint": "task snapshot decides exact version"},
  "tensor_contract": {"input_dtypes": ["float16", "bfloat16"], "accumulation_dtype": "float32", "layouts": ["BHSD"], "dynamic_axes": ["B", "H_q", "H_kv", "S_q", "S_kv", "D"]},
  "hyperparameters": {"causal": true}, "tolerances": {"atol": 0.01, "rtol": 0.01, "max_abs_error": 0.05},
  "prohibited": ["muDNN", "muBLAS", "SDPA", "ATen", "CUDA residue"], "entrypoint": "starter/run.sh",
  "editable_files": ["starter/src/launch.mu", "starter/src/kernel.mu"], "attempt_budget": {"max_attempts": 20, "wall_time_seconds": 7200},
  "outputs": {"required": ["output"], "optional": ["lse"]}
}
